{
  "schema_version": "1.0",
  "wp_id": "wigner-tomography",
  "code_version": "0.4.0",
  "runner_version": "0.1.0",
  "repository": "https://github.com/Strobo-Travels-Deep/root",
  "artifact": {
    "path": "numerics/reach_ladder_ideal.h5",
    "format": "hdf5",
    "bytes": 2134336,
    "sha256": "e3b48a24277a864f98403a794251fe7205cc8178e95189f3ed6a0c27222d8209"
  },
  "execution": {
    "timestamp": "2026-05-15T11:00:03.094069+00:00",
    "engine": "python-scipy",
    "precision": "complex128",
    "elapsed_s": 0.18397188186645508
  },
  "provenance_hash": "eb60e465591821ea2f16b062dae13461c22c26c631ec931bdf1fbb65119f6412",
  "payload": {
    "physical_parameters": {
      "beta0": 0.05,
      "alpha_coherent": 1.0
    },
    "grid": {
      "size": 81,
      "B_grid": 4.0,
      "d_beta": 0.10000000000000009,
      "axis": "linspace(-B_grid, B_grid, grid_size)"
    },
    "states": [
      "vacuum",
      "coherent"
    ],
    "n_pulses_values": [
      20,
      40,
      60,
      80
    ],
    "per_n_summary": {
      "N_20": {
        "n_pulses": 20,
        "B_N": 1.0,
        "n_in_disk": 317,
        "elapsed_s": 0.016
      },
      "N_40": {
        "n_pulses": 40,
        "B_N": 2.0,
        "n_in_disk": 1257,
        "elapsed_s": 0.026
      },
      "N_60": {
        "n_pulses": 60,
        "B_N": 3.0,
        "n_in_disk": 2821,
        "elapsed_s": 0.052
      },
      "N_80": {
        "n_pulses": 80,
        "B_N": 4.0,
        "n_in_disk": 5025,
        "elapsed_s": 0.08
      }
    },
    "convention": {
      "beta0_phase": "real positive (arg \u03b2\u2080 = 0)",
      "dirichlet_branch": "monotone central lobe 0 \u2264 x \u2264 2\u03c0/N",
      "phi_train_formula": "(\u03b8 \u2212 (N\u22121) x / 2) mod 2\u03c0",
      "C_chi_relation": "C(\u03b2) = exp(-|\u03b2|\u00b2/2) \u00b7 \u03c7(\u03b2)  [ideal \u03c3_z SDF]"
    },
    "tags": [
      "WP-W",
      "D2",
      "reach-ladder",
      "ideal-SDF",
      "analytic-chi"
    ]
  }
}
